arxiv_id,title,summary,posted_at,qiita_url,status
2601.05986v1,Deepfake detectors are DUMB: A benchmark to assess adversarial training robustness under transferability constraints,"概要：本研究は、攻撃の可視性制約とデータセット間構成の条件下での転移可能性制約下で、ディープフェイク検出システムの堅牢性を評価し、不一致シナリオに対する防御者の視点を映射する結果を提供します。五つの最先端の検出器は、二つのデータセットに対して三種類の攻撃を使用して評価され、攻撃者が限られた知識を持ちながら不可視の干渉によってモデルの性能が低下する状況での敵対的トレーニング戦略の有効性を理解するために実施されました。

新規性：本研究はDUMB手法を拡張しています。この手法自体はこの要約の中で明示的に新しいものとして説明されていませんが、その手法がディープフェイク検出に適用され、攻撃者が限られた知識を持ちながら実世界の状況での敵対的トレーニング効果を探索することによって、研究の関連性が高まっています。

主要な方法：評価には、二つのデータセットに対して三種類の攻撃（PGD、FGSM、FPBA）を使用して転移可能性制約とデータセット間構成の条件下で五つの最先端のディープフェイク検出システムを用いた検出器の評価が含まれます。また、敵対的トレーニング戦略も焦点となり、実際的な敵対的状況での影響を理解するために使用されました。

評価：検出器に対する不可視の干渉に対する堅牢性を評価するための実験は、転移可能性制約とデータセット間構成の条件下でFaceForensics++とCeleb-DF-V2データセットを使用して五つの最先端のディープフェイク検出システムに対して行われました。

議論 / 欠点：研究では、敵対的攻撃者が限られた知識を持ちながら異なる分布に露出された場合でも敵対的トレーニングが同一分布内の堅牢性を強化する一方で、データセット間配置下での性能が低下することが見つかりました。これは、実際的な敵対的攻撃に対して防御策を立てる際にケースに対する意識が必要であることを示唆しています。

まとめ：本研究はDUMB手法をディープフェイク検出に適用することで、転移可能性制約とデータセット間構成の条件下で不可視の干渉に対する検出器の堅牢性を評価し、FaceForensics++とCeleb-DF-V2データセットを使用して五つの最先端システムを用いて実施しました。実験結果は、敵対的トレーニング戦略が同一分布内の堅牢性を強化する一方で、異なる分布間ではその効果が異なる場合があり、これは実際的な攻撃に対して敵対者が限られた知識を持ちながらミスマッチしたデータ分布シナリオが一般的である場合にケースに対する意識が必要であることを示しています。",2026-01-12T08:31:58.639116,dummy,test
